{
  "schema_version": 5,
  "id": "icefog72-sillytavern-everytextlineeditor",
  "name": "SillyTavern Every Text Line Editor",
  "kind": "extension",
  "summary": "SillyTavern extension providing a unified editor for prompts, lorebook entries, personas, and connection profiles with snapshots.",
  "metadata_status": "curated",
  "source": {
    "type": "github",
    "repository": "IceFog72/SillyTavern-EveryTextLineEditor",
    "repository_id": 1240388057
  },
  "frontends": ["sillytavern"],
  "primary_function": "interface-workflow",
  "capabilities": [
    "prompt-engineering",
    "character-worldbuilding",
    "instruction-control"
  ],
  "cataloged_at": "2026-07-23T00:00:00Z",
  "catalog_cohort": "seed",
  "visibility": "published",
  "refresh_policy": "automatic",
  "visibility_reason": null,
  "enrichment_policy": "automatic"
}
