{
  "schema_version": 5,
  "id": "lenanderson-sillytavern-landingpage",
  "name": "SillyTavern-LandingPage",
  "kind": "extension",
  "summary": "A SillyTavern extension that provides a landing page for selecting characters to continue conversations. Clicking a character on the page directly opens their most recent chat session for quick access.",
  "metadata_status": "curated",
  "source": {
    "type": "github",
    "repository": "LenAnderson/SillyTavern-LandingPage",
    "repository_id": 733163811
  },
  "frontends": ["sillytavern"],
  "primary_function": "interface-workflow",
  "capabilities": [],
  "cataloged_at": "2026-07-26T00:00:00Z",
  "catalog_cohort": "standard",
  "visibility": "published",
  "visibility_reason": null,
  "refresh_policy": "automatic",
  "enrichment_policy": "automatic"
}
