{
  "schema_version": 5,
  "id": "nattaphat010447-nutho-autocloser",
  "name": "Nutho Autocloser",
  "kind": "extension",
  "summary": "Nutho Autocloser is a SillyTavern extension that automatically closes elements in the chat interface. It saves users from performing repetitive closing actions during their roleplay sessions.",
  "metadata_status": "curated",
  "source": {
    "type": "github",
    "repository": "nattaphat010447/nutho_autocloser",
    "repository_id": 1275541730
  },
  "frontends": ["sillytavern"],
  "primary_function": "interface-workflow",
  "capabilities": ["automation"],
  "cataloged_at": "2026-07-23T00:00:00Z",
  "catalog_cohort": "seed",
  "visibility": "published",
  "refresh_policy": "automatic",
  "visibility_reason": null,
  "enrichment_policy": "automatic"
}
