{
  "schema_version": 5,
  "id": "hibanan-disable-global-lore",
  "name": "Disable Global Lore",
  "kind": "extension",
  "summary": "Disable Global Lore is a SillyTavern extension that adds a per-character toggle to exclude global lorebooks from prompt context. It enables finer control over which lore entries influence each character's conversations.",
  "metadata_status": "curated",
  "source": {
    "type": "github",
    "repository": "Hibanan/disable-global-lore",
    "repository_id": 1288823245
  },
  "frontends": ["sillytavern"],
  "primary_function": "interface-workflow",
  "capabilities": ["instruction-control", "prompt-engineering"],
  "cataloged_at": "2026-07-23T00:00:00Z",
  "catalog_cohort": "seed",
  "visibility": "published",
  "refresh_policy": "automatic",
  "visibility_reason": null,
  "enrichment_policy": "automatic"
}
