{
  "schema_version": 5,
  "id": "b4bysw0rld-sillytavern-typefacer",
  "name": "SillyTavern TypefaceR",
  "kind": "extension",
  "summary": "SillyTavern TypefaceR is an extension that lets users customize fonts for chat messages. It supports local system fonts and Google Fonts, giving users flexible control over interface typography.",
  "metadata_status": "curated",
  "source": {
    "type": "github",
    "repository": "b4bysw0rld/SillyTavern-TypefaceR",
    "repository_id": 1105308117
  },
  "frontends": ["sillytavern"],
  "primary_function": "interface-workflow",
  "capabilities": [],
  "cataloged_at": "2026-07-23T00:00:00Z",
  "catalog_cohort": "seed",
  "visibility": "published",
  "refresh_policy": "automatic",
  "visibility_reason": null,
  "enrichment_policy": "automatic"
}
